field,title,summary,cleaned_summary,negative_p,neutral_p,postive_p,subjectivity,subjectivity type
world,Blast in Tehran Near State Broadcasting Headquarters Rattles Iran,an explosion in a park near the state broadcasting company rocked irans capital early saturday morning no casualties were reported and it was uncertain if the blast was an attack or accident,explosion park near state broadcasting company rocked irans capital early saturday morning casualties reported uncertain blast attack accident,0.275,0.725,0,0.35,Objective
world,Colombia Names 13 Ex-Soldiers Among Haiti Assassination Suspects,one told his wife that he had a very good job opportunity colombian military veterans have been known to act as hired guns after their service,one told wife good job opportunity colombian military veterans known act hired guns service,0,0.793,0.207,0.35,Objective
world,Educators’ Unions Praise C.D.C. Schools Guidance But Acknowledge Challenges,the unions also acknowledged that challenges lay ahead especially given that vaccines have not been authorized for students under 12,unions also acknowledged challenges lay ahead especially given vaccines authorized students 12,0,0.936,0.064,1,Opinion
world,Taliban Enter Kandahar City and Seize Border Posts,the insurgent assaulted a vital city in afghanistans south on friday less than 24 hours after president biden reaffirmed his decision to withdraw from the country,insurgent assaulted vital city afghanistans south friday less 24 hours president biden reaffirmed decision withdraw country,0.115,0.811,0.074,0.233333333,Objective
world,"Yury Dokhoian, Chess Coach Who Guided Kasparov, Dies at 56",a russian grandmaster he spent a decade working with the longtime world champion who said mr dokhoian gave him stability and confidence he died of the coronavirus,russian grandmaster spent decade working longtime world champion said mr dokhoian gave stability confidence died coronavirus,0.103,0.69,0.207,0.05,Objective
world,Here’s what we know about the new schools guidance the C.D.C. issued on Friday.,the recommendations are a departure from the cdcs past guidelines for schools and arrive less than a month before the first day of school for some districts,recommendations departure cdcs past guidelines schools arrive less month first day school districts,0,1,0,0.216666667,Objective
world,"The C.D.C. Issues New School Guidance, With Emphasis on Full Reopening",the guidance acknowledges that many students have suffered from months of virtual learning,guidance acknowledges many students suffered months virtual learning,0.211,0.789,0,0.5,Objective
world,"After Ex-President’s Arrest, South Africa’s Governing A.N.C. Is More Fractured",there was a sense of relief when jacob zumas arrest went off without bloodshed but his deeply divided party must now find a way forward,sense relief jacob zumas arrest went without bloodshed deeply divided party must find way forward,0.057,0.74,0.202,0.2,Objective
world,"Plane Crash in Sweden Kills 9, Including 8 Sky Divers",the incident was the second to affect a parachutists flight after a similar disaster in the country in 2019,incident second affect parachutists flight similar disaster country 2019,0.186,0.814,0,0.2,Objective
world,London Police Officer Pleads Guilty to Murdering Sarah Everard,wayne couzens had already admitted to kidnapping and raping the 33yearold ms everard whose killing in march set off an outcry against gender violence in britain,wayne couzens already admitted kidnapping raping 33yearold ms everard whose killing march set outcry gender violence britain,0.426,0.538,0.036,0,Factual
world,Factory Fire in Bangladesh Kills at Least 51,the blaze at a sevenstory building where fruit drinks packing materials and plastic packaging were made burned for nearly 24 hours,blaze sevenstory building fruit drinks packing materials plastic packaging made burned nearly 24 hours,0,1,0,0.4,Objective
world,Political instability was fueling a rise in gang violence even before the president was killed.,armed groups have become increasingly powerful in haiti playing on the political instability and the growing poverty to seize control of large swaths of big cities,armed groups become increasingly powerful haiti playing political instability growing poverty seize control large swaths big cities,0.104,0.696,0.199,0.407142857,Objective
world,Biden’s New Push,the us economy suffers from a lack of competition president biden wants to change that,us economy suffers lack competition president biden wants change,0.293,0.707,0,0.4,Objective
world,"Pfizer says it will pursue booster shots and a new vaccine, citing the Delta variant.",,,0,0,0,0,Factual
world,What we know and don’t know about the assassination.,,,0,0,0,0,Factual
world,"2 Americans Claim They Were ‘Translators’ in Haiti Leader's Killing, Judge Says",the two men maintained that the plot to kill president jovenel moïse had been planned intensively for a month a judge involved with the investigation said,two men maintained plot kill president jovenel moïse planned intensively month judge involved investigation said,0.158,0.842,0,0,Factual
world,Two rivals aim to take control in Haiti as the president’s death leaves a power vacuum.,,,0,0,0,0,Factual
world,Chasing After Mysteries in Victoria’s High Country,snowcapped mountains lush green valleys and a string of unsolved disappearances,snowcapped mountains lush green valleys string unsolved disappearances,0,1,0,0.3,Objective
world,Your Friday Briefing,why europeans cant travel to the us,europeans cant travel us,0,1,0,0,Factual
world,"Citing the Delta Variant, Pfizer Will Pursue Booster Shots and a New Vaccine",scientists were critical of the announcement pointing to evidence that the current twodose regimen is powerfully effective against the coronavirus,scientists critical announcement pointing evidence current twodose regimen powerfully effective coronavirus,0.098,0.769,0.132,0.666666667,Opinion
world,Political Crisis in Haiti as Two Prime Ministers Claim Power,despite the interim prime ministers claim that he is in charge after the presidents assassination a volatile political situation poses yet another challenge to democracies in the western hemisphere,despite interim prime ministers claim charge presidents assassination volatile political situation poses yet another challenge democracies western hemisphere,0.121,0.839,0.04,0.05,Objective
world,"Assassination in Haiti: What We Know, and Don’t Know",the killing of president jovenel moïse has rocked the nation stoking fear and confusion about what is to come,killing president jovenel moïse rocked nation stoking fear confusion come,0.38,0.62,0,0,Factual
world,Tokyo Olympics: Inside the Games with The Times,from protests and covidrelated bans on most fans to new sports like surfing and skateboarding times journalists discuss what makes tokyo 2020 unique,protests covidrelated bans fans new sports like surfing skateboarding times journalists discuss makes tokyo 2020 unique,0.075,0.827,0.098,0.727272727,Opinion
world,Your Friday Briefing,suspects detained in haiti,suspects detained haiti,0.718,0.282,0,0,Factual
world,Afghan War Casualty Report: July 2021,at least 161 afghan security forces and 24 civilians were killed in afghanistan in the first eight days of july,least 161 afghan security forces 24 civilians killed afghanistan first eight days july,0.181,0.723,0.096,0.244444444,Objective
world,Will Surgery Slow Down (or Speed Up) a Pope Who’s in a Hurry?,pope francis has often mused about his own mortality and even possible resignation but now as he races to recast the church time is of the essence more than ever,pope francis often mused mortality even possible resignation races recast church time essence ever,0.052,0.948,0,1,Opinion
world,Italians Pay Last Respects to Raffaella Carrà,raffaella carrà spent five decades beaming into the homes of italians on television public mourning for her has few precedents in italy,raffaella carrà spent five decades beaming homes italians television public mourning precedents italy,0.121,0.879,0,0.083333333,Objective
latest,More Power Lines or Rooftop Solar Panels: The Fight Over Energy’s Future,the president and energy companies want new transmission lines to carry electricity from large solar and wind farms some environmentalists and homeowners are pushing for smaller more local systems,president energy companies want new transmission lines carry electricity large solar wind farms environmentalists homeowners pushing smaller local systems,0,0.888,0.112,0.345779221,Objective
latest,The Big Question of the 2022 Midterms: How Will the Suburbs Swing?,democrats and republicans are already jockeying for a crucial voting bloc that soured on donald trump tilted to joe biden and now holds the key to the second half of the presidents term,democrats republicans already jockeying crucial voting bloc soured donald trump tilted joe biden holds key second half presidents term,0,1,0,0.453333333,Objective
latest,"After All-Night Hearing, Texas Republicans Advance Voting Measure",a republicanbacked bill to overhaul the states voting system cleared a key house committee in the legislature on sunday morning after nearly 24 hours of testimony,republicanbacked bill overhaul states voting system cleared key house committee legislature sunday morning nearly 24 hours testimony,0,0.947,0.053,0.7,Opinion
latest,"Branson Beats Jeff Bezos to Space, Aiming to Open Space Tourism",the successful trip was the first in a series to the edge of space and beyond by billionaire entrepreneurs that seek to make human spaceflight more routine,successful trip first series edge space beyond billionaire entrepreneurs seek make human spaceflight routine,0,0.872,0.128,0.461111111,Objective
latest,Richard Branson Calls Flight to Space ‘Experience of a Lifetime’,the virgin galactic space plane landed in new mexico minutes after the crew was carried to the edge of space heres the latest on the flight,virgin galactic space plane landed new mexico minutes crew carried edge space heres latest flight,0,1,0,0.677272727,Opinion
latest,Political Rivals in Haiti Vie for Power After President’s Assassination,the countrys interim prime minister and the senate president were both jockeying for control after the killing of president jovenel moïse,countrys interim prime minister senate president jockeying control killing president jovenel moïse,0.18,0.82,0,0,Factual
latest,How Local Guerrilla Fighters Routed Ethiopia’s Powerful Army,a scrappy force of local tigrayan recruits scored a cascade of battlefield victories against the ethiopian military one of africas strongest times journalists witnessed the decisive week in an eightmonth civil war,scrappy force local tigrayan recruits scored cascade battlefield victories ethiopian military one africas strongest times journalists witnessed decisive week eightmonth civil war,0.165,0.712,0.122,0.05,Objective
latest,Death Valley Hits 130 Degrees as Heat Wave Sweeps the West,temperatures were broiling from utah to california as another heat dome led western states to set up cooling centers and issue motel vouchers,temperatures broiling utah california another heat dome led western states set cooling centers issue motel vouchers,0,1,0,0,Factual
latest,The Police Called It An Accident. She Turned to 1-800-Autopsy.,the close ties between coroners and law enforcement have fueled an unusual and unregulated industry forprofit forensic examinations,close ties coroners law enforcement fueled unusual unregulated industry forprofit forensic examinations,0,1,0,1,Opinion
latest,How Did Allison Highwolf Die? Distrust Fuels a Mystery in Indian Country.,when a northern cheyenne family questioned their daughters untimely death official indifference deepened their pain  and their suspicions,northern cheyenne family questioned daughters untimely death official indifference deepened pain suspicions,0.486,0.514,0,0,Factual
latest,A Breathalyzer to Detect Covid-19? Scientists Are on It.,scientists have been dreaming of diseasedetecting breathalyzers for years has the time for the technology finally come,scientists dreaming diseasedetecting breathalyzers years time technology finally come,0,1,0,1,Opinion
latest,"Short on vaccines, Asia grapples with Delta-driven outbreaks.",across the region everyday activities are again being restricted even as the west edges back to normalcy,across region everyday activities restricted even west edges back normalcy,0.14,0.86,0,0.3,Objective
latest,Soccer Success Is Making England ‘Whole Again’,the stunning rise of englands soccer team is helping define a new vision of englishness putting the lie to those who would stir culture wars,stunning rise englands soccer team helping define new vision englishness putting lie would stir culture wars,0.115,0.669,0.217,0.727272727,Opinion
latest,"Messi Wins First Title With Argentina, Against Brazil in Copa América",a star players glittering career finally gets the one honor it was missing a major title with his national team,star players glittering career finally gets one honor missing major title national team,0.094,0.769,0.137,0.516666667,Opinion
latest,Euro 2020 Final: England vs. Italy Live Updates,,,0,0,0,0,Factual
latest,The Trumpian Roots of the Chip Crisis,were still paying the price of tantrumbased policy,still paying price tantrumbased policy,0,1,0,0,Factual
latest,Oath Keepers Leader Sits for F.B.I. Questioning Against Legal Advice,in a bold move stewart rhodes the founder and leader of the rightwing militia group sat for an interview with federal agents after they seized his phone in may,bold move stewart rhodes founder leader rightwing militia group sat interview federal agents seized phone may,0,0.915,0.085,0.666666667,Opinion
latest,To Kill a Swan? Dispute Over a Bird’s Fate Ends With a Twist.,a mute swan beloved by some was set to be euthanized after wildlife officials deemed him dangerously aggressive then something unexpected happened,mute swan beloved set euthanized wildlife officials deemed dangerously aggressive something unexpected happened,0.171,0.706,0.123,0.966666667,Opinion
latest,Sun Valley's Mogul Conference Is Back In Session,top officials from business government and more have returned to allen  companys annual gathering of power brokers,top officials business government returned allen companys annual gathering power brokers,0,0.899,0.101,0.5,Objective
latest,"Danny Shanahan, Cartoonist With an Absurd Touch, Dies at 64",he drew about 1000 cartoons for the new yorker populated by clowns snowmen cats dogs elvis and more but his career with the magazine ended under a cloud,drew 1000 cartoons new yorker populated clowns snowmen cats dogs elvis career magazine ended cloud,0,1,0,0.454545455,Objective
latest,Could Gen Z Free the World From Email?,its actually crazy how outdated it is people born after aol mail was invented seem to prefer to communicate in almost any other way,actually crazy outdated people born aol mail invented seem prefer communicate almost way,0.094,0.906,0,0.766666667,Opinion
latest,Texas Man Who Waited Hours to Vote Is Arrested on Charges of Illegal Voting,hervis rogers was ineligible to cast a ballot in the 2020 presidential primary because he was still on parole according to the states attorney general he now faces four decades in prison,hervis rogers ineligible cast ballot 2020 presidential primary still parole according states attorney general faces four decades prison,0.096,0.904,0,0.5,Objective
latest,The Ascension of Bernie Sanders,the senator is willing to break a few eggs over easy to get democrats back on track to their workingclass roots,senator willing break eggs easy get democrats back track workingclass roots,0,0.873,0.127,0.527777778,Opinion
latest,"Sorry, We Aren’t Going Back to the Movies",the pandemic forced hollywood to fully embrace the hometheater experience leaving struggling cine in the dust,pandemic forced hollywood fully embrace hometheater experience leaving struggling cine dust,0.271,0.608,0.121,0.2,Objective
